{
  "schema_version": "1.0",
  "inventory_id": "REAL-DATA-INVENTORY-20260821-V0.5",
  "generated_at": "2026-08-21T14:25:00.7386636+08:00",
  "decision": "BLOCKED",
  "database_snapshot": {
    "logical_path": "artifacts/news-real-preflight-v0.5/analysis-v2.db",
    "sha256": "d1d30fc43897a8cccc6b370a05a4926c7cc0d44f488cdffaa82cda5a36f9d67a",
    "isolated_copy": true,
    "source_database_modified": false,
    "preview_service_stopped_after_export": true
  },
  "news_database": {
    "events_total": 254,
    "events_non_demo": 254,
    "events_demo": 0,
    "articles": 260,
    "claims": 260,
    "evidence_records": 267,
    "reports": 260,
    "reports_with_top_level_novelty": 0,
    "company_impacts": 0,
    "industry_impacts": 48,
    "industry_impact_breakdown": {
      "banking_and_financial_services": 23,
      "pharma_and_life_sciences": 15,
      "power_generation_transmission_and_storage": 5,
      "wind_and_clean_energy_equipment": 4,
      "software_and_cloud_services": 1
    },
    "first_seen_min": "2017-04-08T00:00:00+00:00",
    "last_seen_max": "2026-08-20T09:05:37.255227+00:00"
  },
  "news_export": {
    "api_dialect": "news-claws-current",
    "read_only": true,
    "source_snapshot_sha256": "f16feb1fe5edbb3758d68e40b4f54d2b7265392673f948ce36d44d72570d5163",
    "matches_current_database_snapshot": false,
    "requested_limit": 100,
    "api_cursor_available": false,
    "api_max_limit": 200,
    "event_versions": 100,
    "evidence_records": 104,
    "synthetic": false,
    "events_with_direct_ticker_mapping": 0,
    "events_with_industry_only_mapping": 15,
    "events_without_investable_mapping": 85,
    "events_with_zero_novelty": 100,
    "events_with_contract_degradation": 100,
    "observed_at_min": "2026-08-20T09:03:14.525257+00:00",
    "observed_at_max": "2026-08-20T09:04:40.621964+00:00",
    "degradations": {
      "published_at_fell_back_to_first_seen": 100,
      "no_investable_company_or_industry_mapping": 85,
      "novelty_not_exposed_by_api": 100
    },
    "files": {
      "events.json": {
        "sha256": "07048edce2ec084de580a78564707a3b948ace3676dbc82c8b5c33fbff14e8f1"
      },
      "evidence.json": {
        "sha256": "5c6405cd3b5ea0c9c7bbfee471b9755eb899dd65a8848585e0a4f672b808d784"
      },
      "mappings.csv": {
        "sha256": "b46962064ef7cf829fbc799bf27e918261e3f86ed1136c4538c23cc00b5f857c"
      },
      "news_manifest.json": {
        "sha256": "afb14adc97c17d3348146b7227dc972b5ef4d6061ba7c9f086fda23777d6b036"
      }
    }
  },
  "factor_and_prices": {
    "verification_clone": {
      "repository": "SHUREEEE/multi-factor-alpha-platform",
      "branch": "main",
      "commit": "9792ed27059b1179b39cca8fca2982fe22baf86e",
      "clean": true
    },
    "latest_research_artifact": {
      "branch": "codex/v6-tdx-us-research",
      "commit": "365e53e5e85cfa2ee2f530403f3d934cd38b8ca3",
      "evidence_source": "evidence/v0.2.1/real_data_preflight.json",
      "artifact_available_in_verification_clone": false,
      "weights_coverage_end": "2026-07-17",
      "price_coverage_end": "2026-07-17",
      "point_in_time_universe_attested": false,
      "corporate_action_safe_prices_attested": false,
      "known_limitations": [
        "raw close with absolute returns over 35 percent masked",
        "dividends and smaller corporate actions remain unadjusted",
        "current-constituent survivorship bias",
        "borrow cost is a proxy without historical security-level availability"
      ]
    },
    "required_event_date": "2026-08-20",
    "required_t_plus_one_date_or_later": "2026-08-21"
  },
  "pb_and_paper": {
    "real_pb_borrow_feed_present": false,
    "pb_validation_present": false,
    "pb_dry_run_present": false,
    "pb_launch_bundle_present": false,
    "verified_continuous_paper_sessions": 0,
    "required_continuous_paper_sessions": 20
  },
  "gates": {
    "news_is_non_synthetic": true,
    "news_contract_is_complete": false,
    "direct_ticker_mapping_exists": false,
    "usable_primary_window_events_at_least_30": false,
    "out_of_sample_events_at_least_10": false,
    "rolling_and_robustness_gates_pass": false,
    "factor_weights_cover_event_t_plus_one": false,
    "factor_point_in_time_provenance_passes": false,
    "prices_cover_event_t_plus_one": false,
    "prices_are_corporate_action_safe": false,
    "pb_borrow_gates_pass": false,
    "continuous_paper_sessions_at_least_20": false
  },
  "hard_failures": [
    "news_contract_is_complete",
    "direct_ticker_mapping_exists",
    "usable_primary_window_events_at_least_30",
    "out_of_sample_events_at_least_10",
    "rolling_and_robustness_gates_pass",
    "factor_weights_cover_event_t_plus_one",
    "factor_point_in_time_provenance_passes",
    "prices_cover_event_t_plus_one",
    "prices_are_corporate_action_safe",
    "pb_borrow_gates_pass",
    "continuous_paper_sessions_at_least_20"
  ],
  "required_next_inputs": [
    "News_Claws must expose stable novelty and verified company-to-ticker identifiers, or a separately versioned mapping source must be supplied.",
    "Point-in-time factor weights must cover every selected event through the required return window.",
    "Adjusted or total-return prices must cover event T+1 and attest splits, cash and special dividends, and delistings.",
    "A real security-level PB borrow feed and passing PB validation, dry-run, and launch bundle are required.",
    "Twenty gap-free, hashed Paper sessions with freshness and cent-level reconciliation are required."
  ],
  "authorization": {
    "live_trading": "NOT_GRANTED",
    "broker_execution": "BLOCKED"
  }
}
